{"schema_version":"1.0.0","tool":{"id":"agent-patch-guard","version":"0.1.0"},"status":"ok","complete":true,"data":{"verdict":"pass","origin":"snapshot","summary":{"files":1,"added_lines":1,"deleted_lines":1},"files":[{"path":"src/total.js","previous_path":null,"kind":"modified","binary":false,"symlink":false,"added_lines":1,"deleted_lines":1}],"findings":[],"exceptions_applied":[]},"errors":[],"warnings":[],"meta":{"scope":"Explicit supplied Git unified diff artifact; no repository traversal or patch application","limits":{"max_input_bytes":1048576,"max_files":256,"max_changed_lines":20000,"max_findings":256,"max_output_bytes":65536}}}
